[
    {
        "description": "exclusiveMinimum validation",
        "compatibility": "6",
        "schema": {
            "$schema": "https://json-schema.org/v1",
            "exclusiveMinimum": 1.1
        },
        "tests": [
            {
                "description": "above the exclusiveMinimum is valid",
                "data": 1.2,
                "valid": true
            },
            {
                "description": "boundary point is invalid",
                "data": 1.1,
                "valid": false
            },
            {
                "description": "below the exclusiveMinimum is invalid",
                "data": 0.6,
                "valid": false
            },
            {
                "description": "ignores non-numbers",
                "data": "x",
                "valid": true
            }
        ]
    }
]
