[
    {
        "description": "minProperties validation",
        "compatibility": "4",
        "schema": {
            "$schema": "https://json-schema.org/v1",
            "minProperties": 1
        },
        "tests": [
            {
                "description": "longer is valid",
                "data": {
                    "foo": 1,
                    "bar": 2
                },
                "valid": true
            },
            {
                "description": "exact length is valid",
                "data": {
                    "foo": 1
                },
                "valid": true
            },
            {
                "description": "too short is invalid",
                "data": {},
                "valid": false
            },
            {
                "description": "ignores arrays",
                "data": [],
                "valid": true
            },
            {
                "description": "ignores strings",
                "data": "",
                "valid": true
            },
            {
                "description": "ignores other non-objects",
                "data": 12,
                "valid": true
            }
        ]
    },
    {
        "description": "minProperties validation with a decimal",
        "compatibility": "6",
        "schema": {
            "$schema": "https://json-schema.org/v1",
            "minProperties": 1.0
        },
        "tests": [
            {
                "description": "longer is valid",
                "data": {
                    "foo": 1,
                    "bar": 2
                },
                "valid": true
            },
            {
                "description": "too short is invalid",
                "data": {},
                "valid": false
            }
        ]
    }
]
